{
  "schema_version": "1.0.0",
  "manifest_id": "catalog-intake-m-b-source-lock-legacy-59bf57c",
  "license_status": "unverified",
  "access_scope": "local_only",
  "redistribution": "prohibited",
  "artifacts": [
    {
      "artifact_id": "abilities",
      "root_kind": "legacy",
      "relative_path": "data/processed/abilities.json",
      "sha256": "a239274f576ff8d5def38597e809891643e1634427986e6f17eda7fc5294ddce",
      "byte_count": 242092,
      "record_count": 310
    },
    {
      "artifact_id": "items",
      "root_kind": "legacy",
      "relative_path": "data/processed/items.json",
      "sha256": "c9b2e9fe09a08e593b8972360126bfbe8a1069be69e371111d793e4fd2e7ddc6",
      "byte_count": 58325,
      "record_count": 117
    },
    {
      "artifact_id": "moves",
      "root_kind": "legacy",
      "relative_path": "data/processed/moves.json",
      "sha256": "09bf9109858a475f6b9976a9b518ab2203837a2b8566c9fc9261afb5ae8c16cf",
      "byte_count": 549774,
      "record_count": 490
    },
    {
      "artifact_id": "official_target_pool",
      "root_kind": "repository",
      "relative_path": "data/fixtures/regulations/m-b-eligible-pokemon.json",
      "sha256": "205e1772031ba78e6f790ef4bad0782ed85364618f2c007aa3a9996b171ce92d",
      "byte_count": 39040,
      "record_count": 235
    },
    {
      "artifact_id": "pokemon",
      "root_kind": "legacy",
      "relative_path": "data/processed/pokemon.json",
      "sha256": "e89c4f8f79bc5ca8dfc28d6afae40c7c35e8aee522e54341972e52977f72583e",
      "byte_count": 889882,
      "record_count": 275
    },
    {
      "artifact_id": "pokemon_catalog",
      "root_kind": "legacy",
      "relative_path": "data/processed/pokemon_catalog.json",
      "sha256": "f16267653e07446cbcd68d2c9624cc1aea023ef65bf1340d2676fe3cf8f9c411",
      "byte_count": 131413,
      "record_count": 1025
    },
    {
      "artifact_id": "pokemon_usage",
      "root_kind": "legacy",
      "relative_path": "data/processed/pokemon_usage.json",
      "sha256": "69bb38ed7db53a801a5011398943b89c1277f0761cf4e582b5f5b4290742fd96",
      "byte_count": 54746,
      "record_count": 213
    },
    {
      "artifact_id": "pokemon_usage_details",
      "root_kind": "legacy",
      "relative_path": "data/processed/pokemon_usage_details/season_2_rule_0.json",
      "sha256": "a2897e5e037843786770b184eaced13edf0a91ac7ce99d58cfc69b62ab1df377",
      "byte_count": 4143781,
      "record_count": 213
    },
    {
      "artifact_id": "types",
      "root_kind": "legacy",
      "relative_path": "data/processed/types.json",
      "sha256": "d579fdb4fee1e71414ee046f04e5ce01978e3d5569fbc0cff121ab1e969bf02a",
      "byte_count": 31269,
      "record_count": 18
    }
  ]
}
