{
  "schema_version": "1.0.0",
  "manifest_id": "catalog-intake-synthetic",
  "license_status": "unverified",
  "access_scope": "local_only",
  "redistribution": "prohibited",
  "artifacts": [
    {"artifact_id": "official_target_pool", "root_kind": "repository", "relative_path": "target_pool.json", "sha256": "bc9282dbfb0c536e76bcbf5dc7738755ac874a2f15656e8b51cd8e57452a4ff2", "byte_count": 563, "record_count": 3},
    {"artifact_id": "pokemon_usage", "root_kind": "legacy", "relative_path": "data/processed/pokemon_usage.json", "sha256": "f5e057db60d8cb0ef3e03453302f76782a1055d0203241c4043068ca64edcb6f", "byte_count": 295, "record_count": 2},
    {"artifact_id": "pokemon_catalog", "root_kind": "legacy", "relative_path": "data/processed/pokemon_catalog.json", "sha256": "0b8d8175f7e2c110d077b8950fd6fe27d9494f8d2c6042e6a8422f9cd831a8f4", "byte_count": 229, "record_count": 3},
    {"artifact_id": "pokemon", "root_kind": "legacy", "relative_path": "data/processed/pokemon.json", "sha256": "004d35b5b587b86171ef3f8672d5c2b6a37e3c03ab4c9370c2246ce2f9b302a3", "byte_count": 650, "record_count": 3},
    {"artifact_id": "moves", "root_kind": "legacy", "relative_path": "data/processed/moves.json", "sha256": "f630fa70e9b67e4b4d7e4dd05eff1673ab7684583e5e2b1d02d3027353bce8bd", "byte_count": 466, "record_count": 2},
    {"artifact_id": "abilities", "root_kind": "legacy", "relative_path": "data/processed/abilities.json", "sha256": "cc0e8011311d63c63ac7c6f39ee0626d468f3e2bee50182b731400a60c2af726", "byte_count": 179, "record_count": 2},
    {"artifact_id": "items", "root_kind": "legacy", "relative_path": "data/processed/items.json", "sha256": "5dfffb94357eeaa3e61c19dfc25065c45144a6b03057fea585e8f9fd940a5c35", "byte_count": 136, "record_count": 1},
    {"artifact_id": "types", "root_kind": "legacy", "relative_path": "data/processed/types.json", "sha256": "a0c4a71c074f711270ff7b7f7f31d61494b4ab2785d7d1d65b1e081b70243c32", "byte_count": 446, "record_count": 2},
    {"artifact_id": "pokemon_usage_details", "root_kind": "legacy", "relative_path": "data/processed/pokemon_usage_details/season_2_rule_0.json", "sha256": "90399f09136c1bf3831d6b3dc3c1de79897b18f855e8697d6f534987359c5b15", "byte_count": 326, "record_count": 2}
  ]
}
